,sentences
88,Follow me in case you got further queries.
108,"Take milkshakes, lassi, protein supplements after your exercise."
220,"Then about three months ago, I watched something inappropriate and I ejaculated without doing anything."
377,His appetite is good.
429,A total of six maybe and one glass and a half on day 20.
439,"Also, the Flucloxacillin is a penicillin group of drug which is usually safe in pregnancy."
446,Please consult your gynecologist for your antenatal checkup and investigations required to be taken as per your local protocols.
478,As you already have viral etiologies excluded this is time to look for other things which could lead to persistent elevation of the liver enzymes.
487,Hemochromatosis.
503,"In the morning, I take Gemer DS 2 and after breakfast, I take 12 mg Jardiance."
662,"now the treatment part, no role of antibiotics now as there is no active pus discharge one thing that can be done is scraping of the dead floor and margins of ulcer so healing will fasten.it can be done by local surgeon also."
666,I am almost three months late for my period and do not know what to do.
683,"Now in cardiac pain, the pain usually occurs on exertion and relieves with rest."
808,My brother has swelling on his left foot.
823,What medications he is on?
842,Well the pain which comes in or worsen after doing physical movements is highly likely secondary to muscle and bone related.
947,"Chronic hepatitis B, HBeAg positive disease."
991,Base on your findings it might be a lump of fat cells that formed.
1046,I hope I have answered your query in detail.
1209,What is missing in the follicular monitoring profile of the dummy cycle and also your husband's semen analysis test?
1237,"So use the tablet Cyclopam (Dicyclomine and Paracetamol) twice a day for five days, Ofloxacin and Ornidazole twice a day for five days after food, tablet Pantoprazole before breakfast for one week."
1247,"Strenuous work, stressful life, dehydration, anxieties, tension, common cold, allergies, low glucose sugar level, etc., can cause headaches."
1268,What does the problem sound like to you?
1340,Lastly biofeedback therapy which is a computerized software which help him to control his anal sphincter while passing urine or otherwise.
1344,Stop or reduce alcohol intake if taking.
1387,Usually tri dot HIV test is able to rule out HIV after six weeks of exposure.
1426,Is it fine for me to go to my work place (I am a pathologist have to sit for three to four hours only)?
1473,"I sometimes get chest pain but I usually attribute this to my stomach or anxiety, and the chest pain does not tend to accompany the heart palpitation."
1474,My main worry is it is quite regularly happening and it is one singular beat which is ‘off’.
1499,"As you have caries and sensitivity associated, you might not necessarily need an extraction."
1555,"Now, if we assume that it could be because of a physical problem, the child will have to be examined."
1589,please feel free to revert back anytime with any further queries.
1608,Age: 19
1721,I have been experiencing acid problems.
1731,Eat less quantity of food every time than before.
1737,Also add one more drug Levosulpiride for 15 days.
1864,She is diabetic and has hypertension too.
1956,"If there is pain or discomfort hampering routine activities like chewing or talking, a topical formulation like an antiseptic coupled with an analgesic gel can be applied to the ulcer directly for symptomatic relief."
1957,"Also, a nutritional supplement rich in B-complex vitamins is prescribed to promote healing."
1966,Daily intake of at least three to four liters of water.
1970,"Use of interdental floss to clean the surfaces, spaces and contacts between the teeth."
1973,A periodic check up with your dentist once every six months.
2010,Stress?
2061,"Take tablet Amoxiclav (Amoxicillin and Clavulanic acid) 625 mg one tablet twice daily for five days, Zerodol SP (Aceclofenac, Paracetamol, and Serratiopeptidase) one tablet twice daily for five days, capsule Pan D (Pantoprazole) twice daily before meals for five days, Betadine mouthwash gargle in lukewarm water."
2067,Treatment was not done properly.
2087,Now absolute voice rest means you should not even be saying yes/no during the day.
2126,I cannot really see anything at this point.
2203,One suggested Gabapentin and another Sibelium 10 mg once a day at night for a month.
2207,The differential diagnosis for your problem would be as follows.
2227,"Can you advise why my serum iron is not increasing, though my Hb is 11.9?"
2254,I had not experienced breathing issue prior to this and it recently occurred just two weeks ago.
2267,"If there is fluid around the testis, then it can be removed by surgery."
2295,For further doubts consult a dermatologist online --> https://www.icliniq.com/ask-a-doctor-online/dermatologist
2441,I done kshala sutra treatment for fistula .But iam getting pus from that wound from last 10 days continuously.surgery was done 15 days back.
2487,He does not like to wear mask and thinks it is funny when he coughs or sneezes around me.
2499,"Tablet Levocetirizine every night 1/2 hour before sleeping, Flomist Nasal Spray twice daily in both nostrils, Diluted Povidone Iodine gargles 3 times daily, Syrup Macbery cough syrup 5 mL twice a day."
2520,Acknowledge that this is common emotion and you will try your level best to overcome it.
2563,"Lysozyme * 674 ≤ 500 ng/mL, Butyrate‡ 4.5 0.8 – 4.0 mg/mL, Total SCFA's‡ 17 5.0 – 16.0 mg/mL, Occult Blood Positive Negative."
2578,"My question is, do I need crutches?"
2591,I have a history of plaque formation on teeth even before pregnancy.
2622,Should I be concerned?
2711,I had runny nose 2 weeks back but not so much and now that is also gone.
2712,So no runny nose as of now .
2725,Following are the measures to control BP: 1.
2846,I am worried about the side effects of diuretics on the kidney.
2854,It occurs in different spots on both calves.
2861,"This has resulted in two major falls, which resulted in trauma."
2965,I have PCOS and have been trying to conceive for four months.
2985,I observed the presence of vaginal discharge almost a month ago and I went for a test.
3004,And i visited a doctor and the medicine i used had cured me.
3225,I want to add some medications that are given below.
3283,So do not worry about it.
3397,My question is should I be taking DOGMATIL 50mg?
3401,Duspatalin however can be used and very well tolerated among IBS patients.
3414,But not to worry.
3463,"Also, do I need to be concerned about prostate cancer?"
3532,"Next apply the Lox-2% (Lignocaine hydrochloride) cream (opaque) and not gel, as gel does not get absorbed and the cream crosses the skin."
3550,Follow up with complete liver function tests.
3610,Avoid pickles and papads.
3889,"Decision to work in COVID 19 pandemic depends on the place you stay, the number of cases you have around, the safety environment of your office and so on."
3892,"Hello, due to the pandemic I'm not allowed to visit a dermatologist in person."
3978,Chest x-ray is normal.
3995,Place a sterile cotton in the ear entrance of the ear canal and change the cotton every 6 hrs.
4057,My mother is having lower hip side pain for almost a week now.
4079,I would like to know how it started and progressed in detail.
4175,Please send me the pictures and let me help further.
4204,Prescribed Cephalexin and Percocet I went home for recovery.
4212,Did you land on head or abdomen during fall?
4222,Genital molluscum is considered to be a marker of HIV infection.
4229,There is no wound in his umbilical cord.
4257,"Throughout this period, the muscle spasms/contractions(continuous)were covering all the back and front neck muscles at the same time."
4274,You have said you were having hyperthyroidism and after medication you got recovered.
4321,My serum creatinine is 1.17 and I am taking blood pressure and diabetes tablets.
4358,"Last month, I had a bad episode of GERD and was prescribed Pantoprazole for a month."
4410,I see that your previous cycles have been regular but this time you had a delayed cycle which is the first time you observed this.
4497,"Also, I have chronic persistent fatigue and occasional non-specific itching."
4518,"During the said period I get muscle stiffness, cramps and depression."
4561,I have PCOS since I was young.
4618,"Also, there is a large floating pocket probable hematoma."
4657,She has cough since last five days.
4853,"Loose stools are said when stool volume is more than 200 ml in a day, semisolid to liquid in consistency."
4959,Any history of any medicine taken recently for some other issues?
5015,Provide pictures.
5082,Have regular exercises like brisk walking or running according to the capacity for atleast 30 minutes a day.
5105,"For in-between snacks, you can eat fruits, buttermilk (include every day), protein powder in the evening, channa, etc."
5135,If you have swelling of moderate type then put splint for 10-14 days and convert to cast.
5147,"Hello , I am sorry to hear about your situation."
5159,Last time i visited dentist...i had a root canal same side
5255,"If the clinical features such as difficulty in deglutition, difficulty in breathing, breathing difficulty during sleeping, pain radiating to ear, etc., occur consider as a medical emergency and consult with an ENT specialist for tonsillectomy."
5269,I felt only temporary relief.
5440,If I have caused a hiatal hernia will it stay forever?
5550,Is there anyway that a CT scan can determine whether an enlarged lymph node is benign or malignant?
5563,Dentist was schedule to treat it next week after inflammation is better.
5599,Could this just be early pregnancy?
5672,I also have some throat and chest pain.
5735,"Even if you miss a single pill, the chance of pregnancy is very remote."
5800,Revert back with the reports to a general medicine physician online --> https://www.icliniq.com/ask-a-doctor-online/general-medicine-physician
5848,First it was around my genitals and hips but now it is on my hips only.
5873,Many a times the minimal bleeding or spotting could be either due to local genital infections or some ulcers or trauma.
5890,Drink lot of water.
5935,I have gone through your history and understand your concern.
5947,"I was diagnosed with lupus as a teenager but then in early 20s, I was told that I do not have it."
5997,What do I have to do?
6000,I think it is due to any blunt trauma to the eye.
6076,Do I have to quit drinking?
6129,The treatment is according to the cause.
6137,My problem is excess night fall as I am masturbating since around the age of 13-14.
6224,"Yes, this pandemic is causing a lot of stress in everybody is mind."
6353,Can I treat it myself if it needs treatment?
6441,"Do you have noticed any triggers (diets, stress, change in lifestyle, or drinking alcohol ) before such episodes?"
6456,Eosinophilic gastroenteritis.
6482,"Now if you are very sure that it has gone more red after the oil has entered it then also in the absence of other symptoms, you do not need any treatment for it."
6496,There is no specific food for immunity.
6549,I have read that metformin 500is recalled due to cancer scare.
6574,Hope I was able to suggest few helpful information to accelerate your healing.
6639,"For tinnitus, use resound relief app which has so many natural sound combos."
6656,"Or one should have to have evidence that the weight loss was due to gallbladder dyskinesia and not otherwise, then surgery was probably the right decision."
6823,It is now becoming hard for me to stand or be on my feet a long time .
6839,Often taking 4x 30/500mg several times a day.
6848,Now the pain you mention which has started nearly at the time of stop of these medicines; suggest Narocotic bowel syndrome (NBS).
6880,"If there is anything more you want to know, please do inform me."
6887,I am wondering if the results I get in a week's time will be accurate?
6897,"I am worried about possible ovarian cancer as three of my aunts had it, my mom and five aunts had breast cancer and my grandma died of peritoneal cancer of ovarian origin."
7055,Since then I have had two episodes of severe pain in my lower back right side (sacroiliac joint).
7088,How is your sleep?
7123,It will get cleared but can reappear.
7140,"Do not worry, your symptoms particularly relating to food connects your chest pain to a gastric related problem."
7141,"And it fits into GERD (gastroesophageal reflux disease) in which there will be acid reflux, which in turn causes pain due to intolerance of food pipe to the acid."
7182,Your symptoms seem to be due to reflux laryngitis and not due to the growth.
7212,Is there any color change over the lump or redness or pain over the lump?
7267,Within how many minutes to hours of getting up in the morning you start feeling lesser stiffness?
7290,I have a painful lump on my perianal area.
7299,Hello!one day when I masturbated my right testicle went up and at the same time I felt a burning in the perineal area.
7339,"If you are anxious, you need to overcome that too."
7390,I have high levels of prolactin.
7430,"It is not running down my cheek, but does feel a bit more watery."
7435,Could right eye a bit more sensitive than the left?
7610,"If the lesion is persistent or it increases in size, excision of the same is recommended."
7635,"Regarding your urine culture, it would be advisable to check if you had given the sample prior to starting the antibiotics course, as once you start the antibiotics and then submit the sample it may not show any bacterial growth on culture , plus you are likely to develop Antibiotics resistance infection because of inappropriate antibiotics."
7642,- Syrup Citralka 2tsp thrice daily in half glass water when there is burning.
7648,"I am having cramps after having orgasm, very uncomfirtable feeling in my lower body."
7653,"Based on your symptoms, it appears you are suffering from genital tract infection."
7685,These days I cannot go to my doctor due to lockdown.
7711,Avoid wool and strong soaps.
7810,"I have tried Epsom salt baths, Ibuprofen, etc."
7820,Serum lipid profile.
7894,I recommend you do testosterone therapy (TRT).
7955,Thyroid gland destroyed by Radioactive Iodine 14 years ago.
8036,This is happening form yesterday.
8051,I also had a colonoscopy and it showed clear.
8070,Your disease seems to be controlled with Budesonide or previous Mesalamine you took.
8071,"The mucus/pus discharge suggests that there may be some other problem such as anal fissure, anal fistula, or anal sinus which may accompany the ulcerative colitis in its course."
8150,Bronchial Asthma (Formoterol 6 mcg + Budesonide 200 mcg) Inahaler with spacer 2 puffs twice daily and can be taken up to 4 times daily if required.
8154,My father is 68 years old.
8161,He has hiccups while taking food or water.
8183,"Good nutrition diet, regular exercises, quit smoking if doing are the basic ways."
8201,"I am 18 and female, also sorry about the long list."
8206,I suggest you to maintain a journal where you document about the events which have been troubling you and then you can discuss with me about specific events so that psychotherapy can be started to help you.
8229,She has got RA factor 150 and no other problem in blood reports.
8264,If not possible let it be as placed it might fall off itself seeing the condition.
8293,I have a septal deviations on my right side 1mm can that be the reason
8390,I have been in perfect shape for a while.
8506,"Till now, I did not observe any change."
8546,I have had good skin for all my life.
8581,Revert back with the test reports to an orthopaedician and traumatologist online --> https://www.icliniq.com/ask-a-doctor-online/orthopaedician-and-traumatologist
8680,He recommended us UTI course.
8706,Child Abuse
8801,I hope this will help you in understanding her problem.
8809,You have diabetes mellitus and your weight is high as well.
8829,Check your sugar frequently.
8843,"For the last few weeks, I have experienced slight ear pain and symptoms of tinnitus."
8848,Stretch your ear a bit and you can try putting your little finger inside your ear and move it 10 -15 times.
8879,They increase during the summer and varies according to menstrual cycle.
8896,"For your breathing difficulty problem, chest x-ray, EKG, and spirometry like investigation planned according to the need and after discussion with your doctor."
8902,I am 48 years old and I have removed my uterus eight years back.
8931,"Some people using Oxandrolone have developed life-threatening side effects on the liver, spleen, and blood vessels."
9072,Her molar teeth is coming on both left and right side.
9219,"Now, I am still on Montelukast + Cetirizine once tablet once a day, and Loratadine 10 mg one tablet once a day at bedtime."
9322,"I have experienced blood clots, but these were different."
9344,No improvement since seven days and then he gave Acetylcysteine 600 mg.
9372,"IgE, IgG and IgA antibodies normal, IgE skin prick testing normal, C1 inhibitor slightly low, cortisol low (ACTH stim test not performed), fasting hypoglycemia (testing for insulinoma negative so far), and I have mild heart dysfunction (diastolic)."
9412,Nothing to worry.
9472,Welcome to Icliniq.
9584,These teeth are impacted and they will not come out normally and will cause discomfort repeatedly.
9869,"The vomiting stopped, but I still experience the symptoms and not gaining any weight."
9947,"I am suffering from anxiety around the health issues, cancer and tend to obsess about things."
9974,"I do not mean there is a serious risk, but caution is warranted."
10009,I believe when I chewed some crackers one of my fillings got loosened.
10031,She also snores a little.
10088,Can they force me to do the test?
10152,Although this is not the part of the question I like to draw your attention to the suboptimal dose of Effexor for someone who has depression over the 30 years.
10184,Thank you so much in advance!
10205,"for your family, I would advice that corona may continue for few more months as claimed by many studies, so u may have difficulty in visiting hospital for routine visits."
10261,I am 18 weeks 2 days pregnant.
10291,I am a smoker.
10319,I have gone through the query with keen interest and understand your concerns.
10419,"Also, When I move my eyes towards left, my left eyeball goes little upward than the right."
10494," Home remedies I have tried so far: Aloe vera (not much help), Tea tree oil (irritated it), Manuka oil (helps healing where the sore is but seem to irritate the new flare up), Coconut oil (irritated it), Almond oil (seems to soothening it at the moment)."
10629,"I suggest taking Omeprazole 20 mg, 1 capsule 30 minutes prior to breakfast but may take one dose today."
10732,"I do not have any health problems like cough, fever, and pain."
10817,Do you feel any small lump behind the nipples?
10857,I had done some medical tests recently and the liver turned out to be a bit problematic for me.
10951,I am a male aged 52yrs weight 80kg diabitic my doctor has recently advised me gabapentin nt 400 for neuropathy earlier i was on pregab150 so while checking about the reviews from the patients on net i found that 99% were against gabapentin which confused me and thought to have a 2nd opinion kindly advise
10983,So recheck again tomorrow with a morning sample of urine.
10997,"In addition, Senokot also causes diarrhea."
11011,As I am near to delivery is it safe to take these tablets?
11041,"Still, many possibilities are there."
11146,"It would be helpful if you could share the ultrasound reports (pre and post-abortion), and the dates of the events along with the date of doing beta hCG levels to have a better idea of your situation."
11382,"Hello, I welcome you to icliniq."
11396,of medication as many times as I tried to stop paroxetine (seroxat) in collaboration with my psychiatrist of course my body reacted with nausea dizziness and other similar symptoms.
11417,Humira and biologic medications like this work for a while before losing effect till the time of next dose.
11464,"Then used Cosvate GM, Ketoclean and Keto Soap."
11491,Please do not go to Finasteride straight away.
11573,"I would like to know if you have any other medical conditions like diabetes, stroke, high cholesterol or a heart attack to determine your blood pressure goal according to the latest guidelines."
11642,They take advantage of me.
11643,They never heed my words.
11695,"I have consulted the doctor, he confirmed my pregnancy and prescribed me capsule Gestafine 200 (Progesterone soft gelatin 200) one capsule per day for 15 days and Folvite 5 mg one tablet per day for 15 days."
11754,I am having headache which got severe nowadays .
11791,You should also stop any addictions like smoking or alcohol if any.
11844,Just break the vial and take it by mouth.
11859,"Functional GI problem One dose of injection Indrop 2 lac units by mouth, tablet Rifxamin 200 mg thrice daily for three weeks."
11883,Is this classic signs of GERD?
11906,It is not a definite sign of heart disease.
11980,Any relationship issue?
12142,Do the rashes stay at bay then?
12159,I have a case of diarrhea since yesterday and I have gone to the loo quite a few times.
12247,"I will suggest laxatives to you but it will be better to consult your cardiologist too, for the shift of Calciguard retard to another drug because calcium channel blockers can frequently cause constipation."
12275,Hi Thanks for your query It’s good to see ur sugars are good with HBA1c 6.4.
12289,Plenty of fluids is advisable and antibiotics have to be taken on basis of your culture report.
12358,"Again, as long as I am lying flat I do not feel it at all but if I try to move side to side I feel excruciating pain."
12382,I have to stop and think for a while to continue the conversation.
12409,"In the hospital, the doctors say that the liquid in her abdominal cavity cannot be drained with normal methods because of the density of it."
12459,"I have been to doctors here, but I am not satisfied."
12468,"This is a chronic condition characterized by symptoms like chronic throat irritation, feeling of something stuck down the throat, frequent clearing of the throat and excessive throat mucous."
12662,"Or this could be a very early stage of pregnancy where the levels are not sufficient enough to be detected in urine so gives a faint positive test, obviously at this stage usually the pregnancy may or may not be detected on USG (ultrasound)."
12690,Even full swing fan is causing sinus problem now.
12713,You can take Cymbalta and Seroquel.
12766,I used to go to an eye doctor when I was little but I cannot remember when I last went.
12803,"Avoid lifting weights or jerks to the neck, and avoid bad roads."
13150,I had a hard lump on the left lower back between top of the hip bone and lower ribs.
13351,This is extremely strange that at 25 years of age you suffered a cardiac arrest.
13650,I am on Zoloft every day and am doing well for the most part.
13726,If no improvement we can increase the dose or add some other medicines.
13805,From the available description there are two possibilities which need proper evaluation.
13829,Revert back with report and answer to the above question to an internal medicine physician online --> https://www.icliniq.com/ask-a-doctor-online/internal-medicine-physician
13850,"I was tested for paraneoplastic syndrome and came up as reactive on immunofluorescence, but negative ultimately on western blot."
13897,Her weight is 8.2 kg and height is 80 cm.
13954,This is not suppose to happen until a person gets older.
13959,"If not, then please forward it to me."
13960,Revert back with the reports to a urologist online --> https://www.icliniq.com/ask-a-doctor-online/urologist
13977,I also have some unusual taste in my mouth or tongue.
13979,"But, I have not had this before."
14014,My son is 3 and 9 months old.
14016,At the place where we live they speak a different language.
14040,But now he is good in that too.
14054,I had unprotected sex on the fourth day of my periods and I took a contraceptive pill within half an hour.
14218,She still has not got the permanent teeth until now.
14265,But if still your symptoms do not subside you may have to take antibiotics.
14422,"If it reaches up to 75% that is quite possible in the near future, then complications and consequences can be severe."
14537,The pain lasted for hours and continued as a dull ache for the next week.
14547,"I have had a dull ache since the initial attack, but I have not had any more excruciating pain."
14588,Is there any discharge serous or purulent?
14631,Do you have any other associated symptoms like painful menstruation?
14636,Any mental stress can cause even your having exams or any other stress-related activity can affect the regularity.
14734,"I want to add that dehydration, anxiety, panic attacks may cause chills too."
14869,You can consider the following treatment.
14904,I was discharged a week ago and told some COVID-19 patients have been coming back with DVT and or PE.
14910,Kindly answer the following questions to guide you further.
14921,"I can feel dizziness sometimes however, the result of my PT was negative."
14923,My husband and I are hoping to have a baby.
14928,I have a 16-year-old daughter who gets leg pains on a regular basis but not so frequent.
14973,"Bleeding irregularities that typically occur may include breakthrough bleeding (you are having this), spotting between periods, prolonged periods lighter or heavier periods than normal, lack of period (usually after one year)."
14979,"If not too severe, this is the most effective management strategy."
14980,"I have manageable shortness of breath, chest tightness but no cold."
15163,I have been feeling stiff since I have started studying again some days ago.
15194,My periods are not regular.
15228,Can you send me the x-ray report?
