,sentences
55766,"My breathing is much more shallow, and I can sit comfortably at 90% and not even feel bad."
55860,Has to avoid lemon and tamarind.
55864,Shall we continue or discontinue the current prescription?
55900,I have a great deal of self control with the pills and do not take them just because I feel panicky.
55920,Could this be from the herniated disc?
55955,"From your description and the MRI report, it is quite clear that the patient is suffering from what is commonly known as brain stroke (attachment removed to protect patient identity)."
56074,"4) Maniac episodes consist of irritability or euphoric mood, over activity, decreased need for sleep, over-talkative, grandiose, hyper sexuality, the flight of ideas and pressure of speech."
56219,It hurts when I walk and I now have three bumps.
56231,"But corns typically are of long duration, appear over pressure prone areas of the toe and do not subside on their own."
56260,"You may, therefore, start immediately with 50 mg Pyridoxine per day for two months initially."
56269,"I do not have my second premolar in the upper side, I only have the first premolar."
56294,The main problem is that we failed to understand whether my baby is hungry or she is sleepy as in both the cases baby sucks her finger.
56339,Is there any treatment plan for stage 4 endometrium cancer with lung metastasis.
56384,It will be around 10 millicuries.
56400,Avoid nylon undergarments and use cotton ones instead.
56593,"Once opened up, the pain subsides and you can wait for another four weeks to get the root canal completed."
56624,"Here in our place, doctors are not that well informed about these diseases, so they do not really know how to deal with it."
56702,I am getting wierd type of muscle spasms since past 15 years.
56717,Since you are taking Vitamin D but not the Calcium.
56841,"So as I said earlier, if any palpable nodes are present, it should be excised for tissue diagnosis and bronchoscopy can be avoided."
56895,"Once awake, spend your first hour in the sun, either having tea, or reading newspaper or jogging."
56997,If my surgeon would have agreed to just do local with a pain pill I would have been on board.
57005,"Also, I have a minor cold and cough, no fever but coughing some sputum up."
57021,"He cannot do this on a tablet for the same reason, you will move on pain and he will make mistakes."
57060,I have seen multiple doctors for my slightly high CK levels.
57091,"Avoid cosmetic creams, powders and soaps."
57093,That is my story.
57219,"You have mentioned that your blood reports are fine, but have you been tested for thyroid and diabetes?"
57269,Is this too long to wait?
57275,"Vitreous degeneration, vitreous detachment, vitreous hemorrhage, diabetic retinopathy."
57300,She has a couple diagnoses however today she confided in me that she was having thoughts of hurting people and our one year old daughter.
57319,"Also, if there is some genetic issue with your body then that does not allow to grow as well."
57342,"Consume more fresh fruit juices three to four times in a day, that will make you fresh."
57406,Urine culture and USG (ultra sound) abdomen.
57416,Make a special mention to the kind of contraception either of the partners was using and any mishaps during sex.
57439,"If the blood testosterone level is low, even then injections of HCG (human chorionic gonadotrophin) or oral Clomifene is a better choice."
57695,"My eyes feel heavy, I find myself nodding off at work."
57739,So kindly start reducing weight.
57778,"Also read in websites that horny goat weed (750 mg) with maca (150 mg) also gives good results in correction of erectile dysfunction and hence, recently bought one and using for the past one week one tablet per day."
57993,You can take Dulane (Duloxetine) 20 mg at bedtime (if you are not known allergic to this one) this would help to some extent for pain relief.
58004,If it is high it means you have herpes infection.
58034,Opening a bottle and buttoning pants during this time is a lot of effort too.
58148,Hence pregnancy seems unlikely.
58164,Abnormal urination like some times very frequent urination and sometimes very less urination.
58212,"I can provide you with some status, but since I am not sure how to distinguish between prostate cancer and rectum cancer."
58218,It is quite sad that your uncle has advanced stage of cancer.
58252,You have to be treated with antibiotics to resolve your diverticulitis which is active and with antispasmodics to relieve pain.
58269,Removing excess cement stuck in between the crown and natural tooth is a correct procedure.
58275,Your gums should be inflamed in that region due to constant irritation.
58340,Avoid excessively oily and spicy foods.
58594,Nothing more can be done.
58730,Pain occurs due to spasm of the sphincter muscle and surgery aims at its division partly.
58837,"Include plenty of fresh fruits, vegetables and healthy natural supplements like almonds, dates, and walnuts in your daily diet."
58858,"Five days later again I have done a scan in that my NT rate came as 2.1 mm and nasal bone is ossified, the result was satisfactory."
58889,"Week 1: Take the last tablet as soon as you remember and take the next one at your normal time, which may mean taking two tablets in one day."
58925,You need to visit your therapist to do these therapy as you alone might not be able to do these.
58931,I heard Kalarchi powder mixed with pepper and castor oil can be applied on my testicles to cure the above said problems.
58997,If you have any sexual relationship then take precautions because in infection if you do intercourse it will exaggerate your problem.
59001,Take a fibrous diet.
59055,Such minimal fluids can cause ringing sensation without any hearing loss.
59139,"In this condition, I would strongly like to suggest you to consult your dentist again for a clinical examination of the affected area and condition of it for better results."
59159,It seemed to itch the most on her feet.
59169,"It definitely looks worse than it ever did before and we are afraid that it is something more serious and the doctors we have been taking her to, keep misdiagnosing her."
59239,"Coming back to the problem of penis I have early ejaculation, lost of sexual desire, sperms are diluted and sometimes yellowish, crystal clear gel type substance are found in it."
59264,Bone conditions are important for implant stability.
59283,Doctors that I have gone to said I have tendonitis in it now and that is why it hurts in the first place though no testing has been done to confirm it.
59300,Do you have any headaches while observing these flashes?
59529,Periapical abscess due to fracture or secondary caries.
59531,The CT thorax report for chronic cough in comparison made to chest radiograph.
59540,"I understand from your description that you have a chronic cough and did a CT Thorax, but I am confused as there are no CT images attached."
59552,We gave her that in the evening after trying her usual 6 OZ bottle that she did not take even an ounce of it.
59576,"As far as the jerky movements are concerned it is quiet common in children of this age group, they enjoy doing it, so need not panic, just relax and watch your little one grow."
59683,It is a chronic condition and will need long term treatment.
59709,Antral follicle count 5-6.
59769,All not really validated through any test.
59800,"The pain takes a second or two to come, it is not instant on contact."
59839,They will separate the baby cells from the liquid and do test on it.
59860,Does pancreatitis progress slowly?
59873,I do not think you should be worried off as he is still 10 years old and has still more years left for growth.
59877,"Meanwhile, encourage him to participate in sports and do stretching exercises."
59895,No placenta previa.
59942,Go for a walk 30 minutes a day.
60222,"This is a bit lower than normal weight.You were on antidepressant, which you have left, also which could cause anovulation."
60226,"I do not know why you had taken, but this medicine itself can cause absence of cycle."
60291,"But, my doctor did not seem to be concerned as my HDL was high."
60321,Then I felt fine for the next five months.
60398,He has infusion of FOLFOX scheduled for this week.
60441,Is it abnormal or serious?
60535,"Also, use an elastocrepe bandage of six inches width from the toes to just below the knee to reduce the swelling."
60570,Importantly avoid vitamin C or citrus food up to four hours after food as it helps in improving iron absorption.
60648,I am 26 years old and diagnosed with rheumatoid arthritis when I was 23.
60711,I consulted a rheumatologist and a neurologist.
60752,"My father is suffering from asthma and tried most of the treatment, but nothing worked."
60763,Give him one glass of lukewarm milk along with one teaspoon of turmeric powder every night.
60807,It is a small procedure.
60853,I consulted for gait analysis and then chose new running shoe Nike Pegasus 31.
60914,We immediately rushed to hospital.
60919,Except procalcitonin all above values are dropped.
60961,Do not apply any other cream.
60965,For the fungal infection take a tablet of Fluconazole 150 mg once followed by the same tablet one week later.
60966,"Also, wash the area with normal temperature clean water twice daily, and apply Onabet (Sertaconazole Nitrate) or Zimig (Terbinafine Hydrochloride) cream."
61076,It will become clear in two to three days as chicken pox takes two to three days to come full blown.
61164,"When I was little, I sometimes masturbated to amusing stories I heard like a thief being caught and tickled by kids."
61183,"By looking at the history and symptoms, a few things come to my list of differential diagnosis."
61214,Revert with more information to a dermatologist online --> https://www.icliniq.com/ask-a-doctor-online/dermatologist
61288,I have vision problem.
61307,"The extent to which it effects the body organs, depends on the severity of the disease."
61328,Thus the vascularity helps to remove inflammatory products and heal the wound.
61332,What is the conclusive timeline for hepatitis B and C testing?
61338,"Normal ALT, AST, ALP, LD, and albumin."
61367,My upper right one tooth (front tooth) is painful to touch from the front.
61398,Patients need to be on medication for at least some years to minimize chances of relapse.
61474,The treatment of it is to avoid coffee at all and see the difference.
61501,"Secondly, the vaginal swab culture shows infection with streptococcus species and should be treated with sensitive antibiotic like Zinnat."
61538,"Also, keep the child in a separate cot whilst sleeping."
61649,Or could there still be a possibility?
61675,"You should go to an ophthalmologist immediately in case if there is an increase in the number of these floaters, or if you are seeing flashes of light."
61688,You may also do nasal odor tests to confirm the loss of sense of smell and let us know the results of the same.
61705,We were not aware of this during our appointment with the cardiologist.
61709,Thanks for your detailed explanation.
61736,About a week and a half ago I injured my knee while playing soccer.
61943,My H.pylori test is negative.
61964,"Now, my pimple is healed up."
61989,I visited a urologist and he asked me to undergo urine routine and culture tests.
62026,"Just over a month ago, I went to a naturopathic doctor to see if they could provide answers."
62037,"It can be confirmed by skin biopsy, spongiotic dermatitis is a broader term, you must get repeat biopsy and rule out the cause and get treatment accordingly."
62075,My parents and I are worried about the situation and also about the dosage of Sulpitac which has not been reduced till date.
62094,"Since your socket is filled with blood, there is nothing to worry much."
62156,"In the last 12 hours I have a mild discomfort in my left testicle, but it comes and goes."
62159,"It does not feel swollen, but I am not usually paying so much attention to my body."
62228,My daughter is 2.5 years old.
62235,"But the CBC report taken last week shows, she has a high WBC level of 25000."
62331,"You should check your fasting blood, lipid profile, and glucose, and look after your blood pressure values."
62339,The right posterior cerebral artery is hypoplastic.
62384,"kindly share the reports of urine analysis, USG KUB (ultrasound kidney, ureter and bladder) PVR (post residual volume), and blood sugar."
62406,I am confused if this is my period or ovulatory connected and or related to DHEA.
62411,So ovulation is pending naturally and this is endometrium breaking and bleeding in the absence of progesterone which marks the start of the secretory phase of menstrual cycle.
62426,"Secondly, the tiny bump can be a healed ulcer."
62517,"You have a crunching sound when you place your hand across the chest, this suggests either supraspinatus calcification or acromioclavicular joint problem which are most common."
62564,"So, if at all the issues were there, that might have been now settled down and you become absolutely normal."
62646,"You should know that the brain MRI has a much higher sensitivity and specificity for such diagnosis, compared to the CT (computed tomography) scan and it has no risks of radiation."
62665,Sarcoidosis is a chronic granulomatous condition that can be treated only by steroids that you are already taking.
62699,Some of the children in this age group has this pain.
62734,"After that try studying, taking the help of a spectacle (zero power)."
62771,"You could have a cardiac MRI (magnetic resonance imaging), which is much better in assessing the heart's walls thickness and function."
62874,"My advice on treatment: 1) Even if the cause is viral, there can be a bacterial added infection, so start on antibiotics."
62878,3) Gargling with warm salt water or betadine gargles three to four times a day will help.
62938,I feel you should go to dermatologist academic center to seek consultation.
62950,"So, your DCT might be positive."
62955,My son is 17 years old.
63004,"I cannot feel heat or cold temperatures on the glans of my penis either, which I think as signs of neuropathy."
63106,I can comment on the treatment plan only after seeing the picture and x-ray.
63132,The causes of bad breath are either abscess formation associated with pus collection or food lodgment in the fractured tooth.
63153,"Since the additional findings (effusion, lymph nodes, etc.)"
63340,Revert after a week to a medical gastroenterologist online -->https://www.icliniq.com/ask-a-doctor-online/medical-gastroenterologist
63352,"Also, I am on regular thyroid medication."
63376,By seeing the photos which I have attached here for your reference please tell me what it is.
63394,Could you please explain to me?
63409,"Do not worry, you will be fine."
63443,The onset of these symptoms seems to have maybe been gradual but my acknowledgment of how bad they are was definitely more abrupt and coincided with my efforts in trying to climb back into the real world after my depressive episode.
63482,Then his doctor asked for a blood test.
63597,Random aches are also suggestive of colitis and infection.
63667,"Since there was almost immediate evacuation the next day, it is a good sign and it will keep coming out."
63689,Miscellaneous: Nil.
63770,"Warts can develop even years after the infection is acquired, therefore it is never really possible to know whether you are infected or not unless you develop a clinically visible lesion."
63791,Please suggest to me is there any need for a diagnostic check up?
63801,I am 7 months pregnant.
63824,"In highschool, I smoked weed a couple of times when I was in 16-18 years of age."
63831,How long ago was the last time you smoked weed?
63833,Sometimes using marijuana can cause depersonalization-derealization symptoms.
63838,"If these symptoms are persistent and affecting your normal functioning, consult a psychiatrist in your city for evaluation."
64054,"Start her on this medication and watch for her motions if she develops diarrhea, connect with me again."
64204,What are the 10 rules girls with glowing skin follow?
64223,In the urinary bladder when more glucose is present due to osmosis it draws more water and patient get repeated urge to pass urine.
64242,Do I have anything to worry about or trust the latest results that I have no herpes and put this to rest?
64254,Some men cannot grow full beards due to low density of hair follicles in beard area in them and that depends on their genes and hormones.
64314,"I am guessing you are having repeated episodes of tonsillitis, where you have been given antibiotics."
64487,"Making people believe that mental illnesses are like any other medical illnesses, and these occur because of change in neuro-transmitters also help in reducing stigma."
64665,Escitalopram 10 mg for anxiety once a day.
64772,I still have hair loss and brittle nails.
64815,Diarrhea is 20 times a day very watery.
64885,Is it safe to take Gelusil with these medicines?
64892,"Hi doctor,I did a test."
64915,"Also, I feel a horrible pounding headache."
64957,"I checked my blood pressure, and it was 111/63 mmHg."
64980,"It was such a scary and frightening situation where I and my dad did not know what to do and out of nowhere, my dad suddenly pushed her eye with a little pressure and the eye was back in its position as usual."
65004,My all other reports are normal except DHEA-S.
65046,Now no need to do a further investigation as the count is within the limit.
65064,What they did find was a slight increase in trabeculations of the left ventricle.
65164,Cramping and bloating shall subside after your period as well.
65215,I am using Patanjali toothpowder this time and I have done scaling also.
65322,"Report back if needed, otherwise, it will take three to five days to resolve."
65419,I was told by our family pediatrician that it is minor and might go away as time passes.
65429,The next treatment depends on the type of squint.
65571,And do you have any follow up questions for me?
65761,Both are normal.
65776,"Many young drivers feel the same, but you appear to be more affected by anxiety related to driving and parking."
65976,Protovic-DF two teaspoons two times a day (mix in a glass of milk) for six months.
66059,"My grandmother, her parents, and two of her brothers, as well as my father, all died before the age of 50 because of heart attack."
66121,I got pregnant in march this year and got it aborted through medicines (Cytotec).
66150,"I do not drink alcohol, caffeine, smoke, or take any medication regularly."
66178,"Bera test report shows profound hearing loss, but MRI and Ct are fine."
66214,Her recent ultrasound shows placenta previa.
66264,"The dosage of Lignocaine depends on your age, weight and presence of other systemic ilnesses."
66279,Clinical findings are deviation of nasal septum and sinusitis.I would like to know the best treatment other than surgery.
66326,You should monitor your blood pressure three times a day for a week with an electronic blood pressure apparatus.
66454,"However, I would advise taking a fresh sample of blood from the veins and checking the counts again."
66480,"For this reason, I would recommend trying natural ways to relieve your anxiety: Yoga and meditation, recreational sports, going out with friends in the afternoon, taking herbal supplements (Passiflora and Valeriana) in order to improve your situation when the lightheadedness occurs, taking daily Magnesium supplements which can help calm your nervous system and improve your mental health, and reduce maximally coffee or energy drinks intake."
66553,"Do not do heavy strenuous work, do not let anyone do an internal examination for you and no intercourse even."
66622,I am always fatigued.
66663,"Gradually, after about 12 weeks, things went back to about 90 % of normal."
66859,"I often do sense inside my head, i.e., pricking with pins and needles and flu-like symptoms all the time."
66878,"For your detailed physical examination, you need to consult nearby internal medicine specialist."
66903,Revert with more information to an obstetrician and gynaecologist online --> https://icliniq.com./ask-a-doctor-online/obstetrician-and-gynaecologist
66918,"I would suggest you take neutralizing foods like banana, tender coconut, yogurt, and curd."
66944,Always use sunscreen lotion.
67020,"I am studying french, and every time I conjugate, I get a brain fog."
67024,"Being a school counselor, I feel that you are having concentration issues while analyzing or solving any query in your academic work."
67031,Practice helps in skill-building.
67043,"Usually, prenatal vitamins contain vitamin C and you do not need to take any extra supplement."
67074,"Even if it happens rarely because of this, peritonitis has very prominent symptoms like severe pain in the abdomen and you would have needed to be hospitalized."
67116,Do warm water and salt rinse three to four times daily.
67141,"Most commonly, patients present to us with a fuzzy head after improper sleep for a long time (insomnia), long term stress at the workplace, too much caffeine, or caffeinated drinks."
67183,I stopped the Depo Provera because it reduces my bone density.
67189,"My advice is to get it removed and go for a barrier method, which is easy to use and takes no lag time to get back to normal physiological cycle without any delay."
67217,Diane-35 is taken for 21 consecutive days with seven days off.
67230,"But I do feel exhausted, and it takes me days to get back to normal."
67350,Since then I have tried other OTC allergy medicine as well as multiple nasal sprays that do not work.
67462,What are the possibilities and what is the most likely possibility?
67506,I can feel good for a week then I am just whacked out tired and low for a week.
67537,Recently I am not feeling as much libido as it used to be.
67670,Any infection or advanced age or some spine disease.
67676,I have been suffering from nightfall for one and a half years.
67738,Stop if there are any redness and irritation.
67776,"So you have plenty of options, but first, get the investigations done and then consult your urologist."
67879,Please get back to me after four weeks.
67883,"The report said it might be a splenic hemangioma, but that other benign or malignant lesions or metastatic focus cannot be entirely excluded."
67905,I am feeling overweight.
67951,Can I still have abscess left?
68039,"It was red, swollen, painful and tearing."
68056,I am finding it difficult to quit onion.
68072,I heard this happens when the lower wisdom tooth is infected.
68080,"But, this is not enough for this type of infection."
68169,Then he never used alcohol.
68174,"But, now his weight gain and belly fat is also increasing."
68181,"You must stop all oily food, must keep checking his sugar levels."
68301,It seems I am addicted to these medicines.
68313,I have been getting a cold drop of water sensation all over my body.
68396,These measures will also help in relieving your itching.
68440,I have a white patch on the inner side of my foreskin.
68444,How can I get it removed?
68457,You need to take some precautions: Please review with me after three days so that I can guide you further.
68492,Also had a brain MRI done because I thought I definitely had stage 4 cancer.
68533,For further queries consult a medical oncologist online --> https://www.icliniq.com/ask-a-doctor-online/medical-oncologist
68555,"This occurs when the lower third molar, wisdom tooth starts coming out."
68603,Take Makardhwaj Rasayan tablet one tablet twice a day with milk for two to three weeks only.
68694,"High uric acid levels, 5."
68699,I also found out that I have a skin bridge between my foreskin and head.
68731,"analgesics,"
68796,"I have lumps in my breasts, and the nipples curve inward sometimes."
68831,"This pain may be related to noncardiac cause as well, like musculoskeletal or gastric reflux."
68925,Also could high progesterone levels be masking the miscarriage?
68955,"Wearing braces is very common at this age, and different types of them are also available for better esthetics so that you can choose from them according to your needs."
68988,"For a good effective treatment, I need to know what medicines you are taking along with insulin."
69067,"I become happy by seeing his failure to read, but I do not feel that I should myself read for my satisfaction."
69094,"Two years ago, I discovered a small lump in my neck near the back right side."
69117,"I know his mother and sister, and they are proud of him."
69314,And also enlarged spleen creates trouble in pregnancy as uterine growth in pregnancy is affected and enough space might not available as the spleen is much enlarged.
69461,Dengue and other basic reports showed negative.
69498,One would have palpitations and irregularities in heart beating in this case.
69506,It went away after that.
69581,She does not have any history of the same issue and currently not on any medications.
69643,What are the pros and cons of these options?
69666,It is better to have some counseling sessions to do some catharsis and learn relaxation strategies.
69670,"Reduce smoking, if you do."
69751,"I am taking Cilnidipine 10 mg, Rosuvastatin 10 mg, Fenofibrate 150 mg and Clopidogrel 75 mg."
69794,I am currently on Eptoin 100 mg.
69804,"Apart from these two, there are no other major complications."
69809,I consulted gastrologist too.
69956,"Although the dentist did not find any cavities, he could not be sure if I needed a root canal treatment and referred me to an endodontist."
69960,"He also suggested a mouth guard because, the dentin is wearing away on some of the molars, the gums are receding and there are little periodontal pockets forming in those teeth."
69961,"These cracks in my teeth are vertical, straight lines."
69986,I can definitely see a texture difference.
70037,And how long will it continue?
70129,"You need to have a healthy lifestyle like avoiding fatty, oily, fried, and high-calorie diets."
70140,My right testicle is 4.5 x 5.6 cm.
